_id,title,text,query
<dbpedia:Johannes_Nicolaus_Brønsted>,Johannes Nicolaus Brønsted,"Johannes Nicolaus Brønsted (Danish pronunciation: [joˈhanˀəs ˈneɡ̊olɑʊ̯ˀs ˈb̥ʁɶnsd̥ɛð] February 22, 1879 – December 17, 1947) born in Varde, was a Danish physical chemist.He earned a degree in chemical engineering in 1899 and his Ph.D.",who is nicolaus brensted
<dbpedia:Politics_of_Kazakhstan>,Politics of Kazakhstan,"The politics of Kazakhstan takes place in the framework of a presidential republic, whereby the President of Kazakhstan is head of state and nominates the head of government. Executive power is exercised by the government. Legislative power is vested in both the government and the two chambers of parliament.",what are the main issues of kazakhstan
<dbpedia:Junkers_Ju_87>,Junkers Ju 87,"The Junkers Ju 87 or Stuka (from Sturzkampfflugzeug, ""dive bomber"") was a two-man (pilot and rear gunner) German dive bomber and ground-attack aircraft. Designed by Hermann Pohlmann, the Stuka first flew in 1935 and made its combat debut in 1936 as part of the Luftwaffe's Condor Legion during the Spanish Civil War.The aircraft was easily recognisable by its inverted gull wings and fixed spatted undercarriage.",what is the ju stika
<dbpedia:John_Sutter>,John Sutter,"Johann Augustus Sutter (February 15, 1803 – June 18, 1880) was a German-born Swiss pioneer of California known for his association with the California Gold Rush by the discovery of gold by James W. Marshall and the mill making team at Sutter's Mill, and for establishing Sutter's Fort in the area that would eventually become Sacramento, the state's capital.",who was the first sutter
<dbpedia:Transport_in_Kazakhstan>,Transport in Kazakhstan,"The vast territory of Kazakhstan spans across 2.7 million km ².  With a low population density, dissociation centers of industry and agriculture, and remoteness from world markets, the need for different modes of transportation in Kazakhstan are vital.Kazakhstan is committed to regional infrastructure development. According to Kazakhstan Ambassador to the U.S. Kairat Umarov, in 2014 Kazakhstan invested $18 billion to construct more airports, highways, and railroads.",is kazakhstan an area
<dbpedia:Jay_Leno>,Jay Leno,"James Douglas Muir ""Jay"" Leno (/ˈlɛnoʊ/; born April 28, 1950) is an American comedian, actor, writer, producer, voice actor, and television host. He was the host of NBC's The Tonight Show with Jay Leno from 1992 to 2009. Beginning in September 2009, Leno started a primetime talk show, titled The Jay Leno Show, which aired weeknights at 10:00 p.m.",when was jay leno born
<dbpedia:Geography_of_Kenya>,Geography of Kenya,"The geography of Kenya is diverse. Kenya has a coastline on the Indian Ocean, which contains swamps of East African mangroves. Inland are broad plains and numerous hills.Central and Western Kenya is characterised by the Kenyan Rift Valley home to two of Africa's highest mountains, Mount Kenya and Mount Elgon.The Kakamega Forest in western Kenya is relic of an East African rainforest. Much larger is Mau Forest, the largest forest complex in East Africa.",what is kenya's geography
<dbpedia:Josephus>,Josephus,Titus Flavius Josephus (/dʒoʊˈsiːfəs/; 37 – c.,who is tigus jacobs
"<dbpedia:Joseph_Lister,_1st_Baron_Lister>","Joseph Lister, 1st Baron Lister","Joseph Lister, 1st Baron Lister, Bt., OM, FRS, PC (5 April 1827 – 10 February 1912), known as Sir Joseph Lister, Bt., between 1883 and 1897, was a British surgeon and a pioneer of antiseptic surgery. By applying Louis Pasteur's advances in microbiology, he promoted the idea of sterile portable ports while working at the Glasgow Royal Infirmary.",who was joseph lister
"<dbpedia:John,_King_of_England>","John, King of England","John (24 December 1166 – 19 October 1216), also known as John Lackland (Norman French: Johan sanz Terre), was King of England from 6 April 1199 until his death in 1216. Following the battle of Bouvines, John lost the duchy of Normandy to King Philip II of France, which resulted in the collapse of most of the Angevin Empire and contributed to the subsequent growth in power of the Capetian dynasty during the 13th century.",when was john king of england
<dbpedia:Joan_of_Arc>,Joan of Arc,"Joan of Arc (French: Jeanne d'Arc, IPA: [ʒan daʁk]; c. 1412 – 30 May 1431), nicknamed ""The Maid of Orléans"" (French: La Pucelle d'Orléans) is considered a heroine of France for her role during the Lancastrian phase of the Hundred Years' War, and was canonized as a Roman Catholic saint. Joan of Arc was born to Jacques d'Arc and Isabelle, a peasant family, at Domrémy in north-east France.",who was joan of arc
<dbpedia:Transport_in_Kenya>,Transport in Kenya,Transport in Kenya refers to the transportation structure in Kenya. The country has an extensive network of paved and unpaved roads.Kenya's railway system links the nation's ports and major cities and connects Kenya with neighbouring Uganda. There are 15 airports with paved runways.,what is transport system in kenya
<dbpedia:Jon_Voight>,Jon Voight,"Jonathan Vincent ""Jon"" Voight (/vɔɪt/; born December 29, 1938) is an American actor. He has won one Academy Award, out of four nominations, and four Golden Globe Awards, out of ten nominations. He is the father of actress Angelina Jolie and actor James Haven.Voight came to prominence in the late 1960s with his performance as a would-be gigolo in Midnight Cowboy (1969).",is jon vuitt a actor
<dbpedia:John_Wycliffe>,John Wycliffe,"John Wycliffe (/ˈwɪklɪf/; also spelled Wyclif, Wycliff, Wiclef, Wicliffe, Wickliffe; c. 1331 – 31 December 1384) was an English Scholastic philosopher, theologian, lay preacher, translator, reformer and university teacher at Oxford in England. He was an influential dissident in the Roman Catholic Church during the 14th century. His followers were known as Lollards, a somewhat rebellious movement, which preached anticlerical and biblically-centred reforms.",who was john wycliffe
<dbpedia:Telecommunications_in_Kenya>,Telecommunications in Kenya,"Telecommunications in Kenya include radio, television, fixed and mobile telephones, and the Internet.",which telecommunication systems are in kenya
<dbpedia:John_Hanson>,John Hanson,"John Hanson (April 14 [O.S. April 3] 1721 – November 15, 1783) was a merchant and public official from Maryland during the era of the American Revolution. After serving in a variety of roles for the Patriot cause in Maryland, in 1779 Hanson was elected as a delegate to the Continental Congress.",who was hanson
<dbpedia:Telecommunications_in_Kazakhstan>,Telecommunications in Kazakhstan,"This article provides an overview of the communications infrastructure of the country of Kazakhstan.The information was taken from CIA World FactBook (March 20, 2008):Telephones - main lines in use:5.928 million (2009)Telephones - mobile cellular:14,830,000 (2009)Country phone code: +7Telephone system:domestic:intercity by landline, microwave radio relay and satellite communication (KazSat); number of fixed-line connections is gradually increasing and fixed-line teledensity is about 20 per 100 persons; mobile-cellular usage is increasing rapidly and subscriptions now exceed 50 per 100 personsinternational:international traffic with other former Soviet republics and China carried by landline and microwave radio relay; with other countries by satellite and by the Trans-Asia-Europe (TAE) fiber-optic cable; satellite earth stations - 2 Intelsat, KazSatRadio broadcast stations:AM 60, FM 17, shortwave 9 (1998)Radios:6.47 million (1997); 12 million (2009);Television broadcast stations:12 (plus 9 repeaters) (1998); 149 (2009);Internet Service Providers (ISPs):10 (with their own international channels) (2001); 22 (2009);Internet hosts:33,217 (2007);80,000 (2009);Internet users:100,000 (2002);400,000 (2005);1,247,000 (2006);3,130,000 (2008);4,700,000 [1] (2009);Internet country code (Top level domain): KZ",what type of cable is used in kazakhstan
<dbpedia:John_Sealy_Hospital>,John Sealy Hospital,"John Sealy Hospital is a hospital that is a part of the University of Texas Medical Branch complex in Galveston, Texas, United States.",is john sealy hospital a hospital
<dbpedia:Demographics_of_Kiribati>,Demographics of Kiribati,"This article is about the demographic features of the population of Kiribati, including population density, ethnicity, education level, health of the populace, economic status, religious affiliations and other aspects of the population.",kiribati population
<dbpedia:Jeff_Lynne>,Jeff Lynne,"Jeffrey ""Jeff"" Lynne (born 30 December 1947) is an English songwriter, composer, arranger, singer, multi-instrumentalist and record producer who gained fame as the leader and sole constant member of Electric Light Orchestra.",who is jeff lynne
<dbpedia:Joy_Division>,Joy Division,"Joy Division were an English rock band formed in 1976 in Salford, Greater Manchester. Originally named Warsaw, the band consisted of singer Ian Curtis, guitarist and keyboardist Bernard Sumner, bassist Peter Hook, and drummer Stephen Morris.Formed by Sumner and Hook after the two attended a Sex Pistols gig, Joy Division transcended their punk roots to develop a sound and style that made them a pioneering act of the post-punk movement.",who was the drummer for joy division
<dbpedia:Judge_Dredd>,Judge Dredd,"Judge Dredd is a fictional character who appears in British comic books published by Rebellion Developments, as well as in a number of movie and video game adaptations.  He was created by writer John Wagner and artist Carlos Ezquerra, and first appeared in the second issue of 2000 AD (1977), a weekly science-fiction anthology.  He is that magazine's longest-running character.Joseph Dredd is a law enforcement officer in the dystopian future city of Mega-City One in North America.",what is a dredd
<dbpedia:History_of_Kiribati>,History of Kiribati,"The islands which now form the Republic of Kiribati have been inhabited for at least seven hundred years, and possibly much longer. The initial Micronesian population, which remains the overwhelming majority today, was visited by Polynesian and Melanesian invaders before the first European sailors visited the islands in the 17th century. For much of the subsequent period, the main island chain, the Gilbert Islands, was ruled as part of the British Empire.",how long has the island of kiribati been inhabited
<dbpedia:Jack_Kirby>,Jack Kirby,"Jack Kirby (/ˈkɜrbi/; August 28, 1917 – February 6, 1994), born Jacob Kurtzberg, was an American comic book artist, writer, and editor widely regarded as one of the medium's major innovators and one of its most prolific and influential creators.Kirby grew up poor in New York City, and learned to draw cartoon figures by tracing characters from comic strips and editorial cartoons.",who was jack kirby
<dbpedia:Kamikaze>,Kamikaze,"The Kamikaze (神風, [kamikaꜜze]; ""divine"" or ""spirit wind""), officially Tokubetsu Kōgekitai (特別攻撃隊, ""Special Attack Unit""), abbreviated as Tokkō Tai (特攻隊), and used as a verb as Tokkō (特攻, ""special attack""), were suicide attacks by military aviators from the Empire of Japan against Allied naval vessels in the closing stages of the Pacific campaign of World War II, designed to destroy warships more effectively than was possible with conventional attacks.",what was the kaikaze
<dbpedia:John_Walker_Lindh>,John Walker Lindh,"John Phillip Walker Lindh (born February 9, 1981) is a U.S. citizen who was captured as an enemy combatant during the United States' 2001 invasion of Afghanistan in November 2001. He was captured and detained at Qala-i-Jangi fortress, used as a prison. He took part in the Battle of Qala-i-Jangi, a violent uprising of the Taliban prisoners, during which the CIA officer Johnny ""Mike"" Spann was killed, together with all but 86 of the estimated 300–500 prisoners.",where was john walker arrested
"<dbpedia:John_Jellicoe,_1st_Earl_Jellicoe>","John Jellicoe, 1st Earl Jellicoe","Admiral of the Fleet John Rushworth Jellicoe, 1st Earl Jellicoe, GCB, OM, GCVO, SGM (5 December 1859 – 20 November 1935) was a Royal Navy officer. He fought in the Anglo-Egyptian War and the Boxer Rebellion and commanded the Grand Fleet at the Battle of Jutland in May 1916 during World War I.",who is john jellyicoe
<dbpedia:Jack_Brabham>,Jack Brabham,"Sir John Arthur ""Jack"" Brabham, AO, OBE (2 April 1926 – 19 May 2014) was an Australian racing driver who was Formula One champion in 1959, 1960, and 1966. He was a founder of the Brabham racing team and race car constructor that bore his name.Brabham was a Royal Australian Air Force flight mechanic and ran a small engineering workshop before he started racing midget cars in 1948.",who is jack brabham
<dbpedia:Jadavpur_University>,Jadavpur University,"Jadavpur University (Bengali: যাদবপুর বিশ্ববিদ্যালয়) or JU is a premier Public research oriented university located in urban metropolitan city of Kolkata, West Bengal.It has two campuses: the main campus at Jadavpur and the new campus at Salt Lake, approximately 12.6 kilometres (7.8 mi) and 8.8 kilometres (5.5 mi) from the city centre respectively. A third campus is due to open at the site of the erstwhile National Instruments (CSIR India), opposite the main campus along the Raja S.C.",where is jadavpur university located
<dbpedia:Jean_Grey>,Jean Grey,"Jean Grey, or Jean Grey-Summers, is a fictional superhero appearing in American comic books published by Marvel Comics and is a founding member of the X-Men. Jean Grey has been known under the aliases Marvel Girl, Phoenix, and Dark Phoenix. Created by writer Stan Lee and artist Jack Kirby, the character first appeared in The X-Men #1 (September 1963).Jean Grey is a member of a subspecies of humans known as mutants, who are born with superhuman abilities.",who is jean grey
<dbpedia:Foreign_relations_of_Kazakhstan>,Foreign relations of Kazakhstan,Foreign relations of Kazakhstan are primarily based on economic and political security. The Nazarbayev administration has tried to balance relations with Russia and the United States by sending petroleum and natural gas to its northern neighbor at artificially low prices while assisting the U.S. in the War on Terror.,kazakhstan what is the relationship with us?
<dbpedia:Foreign_relations_of_Kuwait>,Foreign relations of Kuwait,"Since its independence in 1961, Kuwait maintained strong international relations with most countries, especially nations within the Arab world.  Its vast oil reserves gives it a prominent voice in global economic forums and organizations like the OPEC.",what countries does kuwait have
<dbpedia:Transport_in_Kuwait>,Transport in Kuwait,"As an oil rich nation, Transport in Kuwait is largely road based, one car for every 2.25 people. Bus services make up Kuwait's entire public transport network, as the country has no rail infrastructure. Several railways are planned, including a Kuwait City metro. Kuwait has several maritime ports along the Persian Gulf. There are seven airports, the largest and only for civil-use is Kuwait International Airport.",what type of transport services is available in kuwait
<dbpedia:Demographics_of_Kyrgyzstan>,Demographics of Kyrgyzstan,"The Demographics of Kyrgyzstan is about the demographic features of the population of Kyrgyzstan, including population growth, population density, ethnicity, education level, health, economic status, religious affiliations, and other aspects of the population. The name Kyrgyz, both for the people and the country, means ""forty girls"" or ""forty tribes"", a reference to the epic hero Manas who unified forty tribes against the Oirats, as symbolized by the 40-ray sun on the flag of Kyrgyzstan.",kyrgyz population
<dbpedia:Demographics_of_Kenya>,Demographics of Kenya,"Kenya is a multi-ethnic state in the Great Lakes region of East Africa. It is primarily inhabited by Bantu and Nilotic populations, with some Cushitic ethnic minorities in the north. Its total population is estimated at 45 million inhabitants as of 2014.A national census was conducted in 1999, but its final results were never released.",what is the ethnicity of kenya
<dbpedia:Julius_Caesar>,Julius Caesar,"Gaius Julius Caesar (Classical Latin: [ˈɡaː.i.ʊs ˈjuː.li.ʊs ˈkae̯.sar]; July 100 BC  – 15 March 44 BC) was a Roman statesman, general and notable author of Latin prose. He played a critical role in the events that led to the demise of the Roman Republic and the rise of the Roman Empire. In 60 BC, Caesar, Crassus, and Pompey formed a political alliance that was to dominate Roman politics for several years.",what does caesar say about the roman empire
<dbpedia:Politics_of_Kyrgyzstan>,Politics of Kyrgyzstan,"The Politics of Kyrgyzstan takes place in the framework of a parliamentary representative democratic republic, whereby the President is head of state and the Prime Minister of Kyrgyzstan is head of government. Executive power is exercised by the government. Legislative power is vested in both the government and parliament.",what is krgyzstan's political system
<dbpedia:Telecommunications_in_Kuwait>,Telecommunications in Kuwait,"Telecommunications in Kuwait provides information about the telephone, Internet, radio, and television infrastructure in Kuwait.",who has telecommunication in kuwait
<dbpedia:History_of_Kenya>,History of Kenya,"A part of Southeast Africa, the territory of what is now Kenya has seen human habitation since the beginning of the Lower Paleolithic. The Bantu expansion from a West African center of dispersal reached the area by the 1st millennium AD.",where is kenya
<dbpedia:Geography_of_Kiribati>,Geography of Kiribati,"This article describes the geography of the Republic of Kiribati. Kiribati consists of 32 atolls and one island scattered over all four hemispheres in an expanse of ocean equivalent in size to the continental United States. The islands lie roughly halfway between Hawaii and Australia in the Micronesian region of the South Pacific. The three main island groupings are the Gilbert Islands, Phoenix Islands, and Line Islands.",which region is kiribati located
<dbpedia:Transport_in_Kiribati>,Transport in Kiribati,The following article outlines transport in Kiribati.,what is the transport in kiribati?
<dbpedia:Telecommunications_in_Kiribati>,Telecommunications in Kiribati,Kiribati has two international airports (Tarawa and Kiritimati). The main port is Betio (Tarawa). Phones are available only on Tarawa and Kiritimati and radio phones are used elsewhere.,what are some airports in kiribati
<dbpedia:James_P._Hogan_(writer)>,James P. Hogan (writer),James Patrick Hogan (27 June 1941 – 12 July 2010) was a British science fiction author.,who was james hogan
<dbpedia:Joseph_McCarthy>,Joseph McCarthy,"Joseph Raymond ""Joe"" McCarthy (November 14, 1908 – May 2, 1957) was an American politician who served as a Republican U.S. Senator from the state of Wisconsin from 1947 until his death in 1957.",who is joseph mccarthy
<dbpedia:Julia_Kristeva>,Julia Kristeva,"Julia Kristeva (French: [kʁisteva]; Bulgarian: Юлия Кръстева; born 24 June 1941) is a  Bulgarian-French philosopher, literary critic, psychoanalyst, sociologist, feminist, and, most recently, novelist, who has lived in France since the mid-1960s.  She is now a Professor at the  University Paris Diderot. Kristeva became influential in international critical analysis, cultural theory and feminism after publishing her first book Semeiotikè in 1969.",who is julia kristeva
<dbpedia:Johnny_Weissmuller>,Johnny Weissmuller,"Johnny Weissmuller (born Peter Johann Weißmüller; June 2, 1904 – January 20, 1984) was an American competition swimmer and actor best known for playing Tarzan in films of the 1930s and 1940s and for having one of the best competitive swimming records of the 20th century. Weissmuller was one of the world's fastest swimmers in the 1920s, winning five Olympic gold medals for swimming and one bronze medal for water polo. He won fifty-two U.S.",who played tarzan in the movies
<dbpedia:Jell-O>,Jell-O,"Jell-O is a registered trademark of Kraft Foods for varieties of gelatin desserts, including fruit gels, puddings and no-bake cream pies.",what is jolt o jelly
<dbpedia:Politics_of_Kiribati>,Politics of Kiribati,"Politics of Kiribati takes place in a framework of a parliamentary representative democratic republic, whereby the President of Kiribati is the head of government, and of a  multi-party system. Executive power is exercised by the government. Legislative power is vested in both the government and the House of Assembly.",what type of government is kiribati
<dbpedia:Geography_of_Kuwait>,Geography of Kuwait,"Kuwait is situated in Southwest Asia, bordering the Persian Gulf, between Iraq and Saudi Arabia. Kuwait was a prosperous trade center for many centuries, Kuwait came to greater international prominence in the post-World War II era largely because of its strategic location at the head of the Persian Gulf and oil revenues.Since 2007, Kuwait has been partially governed by Sabah Al-Sabah and his designated successor, Jaber Al-Sabah, the Prime Minister and Crown Prince.",where is kuwait located
<dbpedia:Politics_of_Kenya>,Politics of Kenya,"The Politics of Kenya take place in a framework of a presidential representative democratic republic, whereby the President of Kenya is both head of state and head of government, and of a multi-party system in accordance with a new constitution passed in 2010. Executive power is exercised by  the executive branch of government, headed by the President, who chairs the cabinet, that is composed of people chosen from outside parliament. Legislative power is vested exclusively in Parliament.",what type of government does kenya have
<dbpedia:Kirk_Hammett>,Kirk Hammett,"Kirk Lee Hammett (born November 18, 1962) is the lead guitarist and songwriter for the heavy metal band Metallica and has been a member of the band since 1983. Before joining Metallica he formed and named the band Exodus. In 2003, Hammett was ranked 11th on Rolling Stone's list of The 100 Greatest Guitarists of All Time. In 2009, Hammett was ranked number 15 in Joel McIver's book The 100 Greatest Metal Guitarists.",who is the lead guitarist of metallica?
<dbpedia:K>,K,"K (named kay /ˈkeɪ/) is the 11th letter of the modern English alphabet and the ISO basic Latin alphabet.  In English, the letter K usually represents the voiceless velar plosive; this sound is also transcribed by /k/ in the International Phonetic Alphabet and X-SAMPA. In English, the letter K is silent in initial position when followed by ""n"", for example ""know"" and ""knight"". The letter K has also been used as a shortening of the affirmation ""okay"".",what is kay
<dbpedia:Kinky_Friedman>,Kinky Friedman,"Richard Samet ""Kinky"" Friedman (born November 1, 1944) is an American Texas Country singer, songwriter, novelist, humorist, politician and former columnist for Texas Monthly who styles himself in the mold of popular American satirists Will Rogers and Mark Twain. He was one of two independent candidates in the 2006 election for the office of Governor of Texas. Receiving 12.6% of the vote, Friedman placed fourth in the six-person race.",what is kinky friedman?
<dbpedia:Koto_(instrument)>,Koto (instrument),"The koto (Japanese: 箏) is a traditional Japanese stringed musical instrument similar to the Chinese zheng, the Mongolian yatga, the Korean gayageum, and the Vietnamese đàn tranh. The koto is the national instrument of Japan. Koto are about 180 centimetres (71 in) length, and made from kiri wood (Paulownia tomentosa). They have 13 strings that are strung over 13 movable bridges along the width of the instrument, and there is also a 17-string koto variant.",what is a koto?
<dbpedia:Demographics_of_Kazakhstan>,Demographics of Kazakhstan,"The Demographics of Kazakhstan enumerate the demographic features of the population of Kazakhstan, including population growth, population density, ethnicity, education level, health, economic status, religious affiliations, and other aspects of the population.",what is kazakhstan's demographics
<dbpedia:Demographics_of_Kuwait>,Demographics of Kuwait,"This article is about the demographic features of the population of Kuwait.Expatriates accounted for 70% of Kuwait's total population in 2014, Kuwaitis are only 30% of the total population. The government and people of Kuwait consider the high level of expatriates to be a problem. Kuwait consists of six governorates: Hawalli, Asimah (Capital), Farwaniyah, Jahra, Ahmadi and Mubarak Al-Kabeer.",what is the demographic of kuwait
<dbpedia:James_Madison>,James Madison,"James Madison, Jr. (March 16, 1751 – June 28, 1836) was an American statesman, political theorist, and the fourth President of the United States (1809–17). He is hailed as the ""Father of the Constitution"" for being instrumental in the drafting of the U.S. Constitution and as the key champion and author of the Bill of Rights. He served as a politician much of his adult life.After the constitution had been drafted, Madison became one of the leaders in the movement to ratify it.",what was james madison
<dbpedia:Foreign_relations_of_Kenya>,Foreign relations of Kenya,"Kenya maintains relations with various countries around the world. Its closest ties are with its fellow Swahili-speaking neighbours in the African Great Lakes region. Relations with Uganda and Tanzania are generally strong, as the three nations work toward economic and social integration through common membership in the East African Community.Kenya's relations with other states vary.",what kind of relations are kenya with the continent
