_id,title,text,query
<dbpedia:Korean_War>,Korean War,"The Korean War (in South Korean Hangul: 한국전쟁, Hanja: 韓國戰爭, Hanguk Jeonjaeng, ""Korean War""; in North Korean Chosungul: 조국해방전쟁, Joguk Haebang Jeonjaeng, ""Fatherland Liberation War""; 25 June 1950 – 27 July 1953) was a war between North and South Korea, in which a United Nations force led by the United States of America fought for the South, and China fought for the North, which was also assisted by the Soviet Union.",what war was korea
<dbpedia:Kabul>,Kabul,"Kabul (/ˈkɑːbəl/; Persian: کابل‎‎ IPA: [ˈkʰɒːbul], Pashto: کابل‎) is the capital of the Islamic Republic of Afghanistan as well as the largest city of Afghanistan, located in the eastern section of the country. According to a 2012 estimate, the population of the city was around 3,289,000, which includes all the major ethnic groups.",kabul is in what province?
<dbpedia:Kumquat>,Kumquat,"Kumquats (or cumquats in Australian English) (UK /ˈkʌmkwɒt/; US /ˈkʌmˌkwɑːt/ or /ˈkʌmkwɔːt/) are a group of small fruit-bearing trees in the flowering plant family Rutaceae, either forming the genus Fortunella, or placed within Citrus sensu lato.The edible fruit closely resembles that of the orange (Citrus sinensis), but it is much smaller, being approximately the size and shape of a large olive. Kumquat is a fairly cold hardy citrus.",what is a cumquat
<dbpedia:Kendo>,Kendo,"Kendo (剣道, kendō, lit. ""sword way"") is a modern Japanese martial art, which descended from swordsmanship (kenjutsu) and uses bamboo swords (shinai) and protective armour (bōgu). Today, it is widely practiced within Japan and many other nations across the world.Kendo is an activity that combines martial arts practices and values with strenuous sport-like physical activity.",what is kendo
<dbpedia:Kraków>,Kraków,"Kraków (Polish pronunciation: [ˈkrakuf]) also Cracow, or Krakow (US English /ˈkrɑːkaʊ/, UK English /ˈkrækɒv/) is the second largest and one of the oldest cities in Poland. Situated on the Vistula River (Polish: Wisła) in the Lesser Poland region, the city dates back to the 7th century. Kraków has traditionally been one of the leading centres of Polish academic, cultural, and artistic life and is one of Poland's most important economic hubs.",what region of poland is krakow
<dbpedia:AMD_K6>,AMD K6,The K6 microprocessor was launched by AMD in 1997. The main advantage of this particular microprocessor is that it was designed to fit into existing desktop designs for Pentium branded CPUs.  It was marketed as a product which could perform as well as its Intel Pentium II equivalent but at a significantly lower price. The K6 had a considerable impact on the PC market and presented Intel with serious competition.,which is an amd microprocessor
<dbpedia:Kurt_Waldheim>,Kurt Waldheim,"Kurt Josef Waldheim (German pronunciation: [ˈkʊɐ̯t ˈvaldhaɪm]; 21 December 1918 – 14 June 2007) was an Austrian diplomat and politician. Waldheim was the fourth Secretary-General of the United Nations from 1972 to 1981, and the ninth President of Austria from 1986 to 1992. While he was running for president in Austria in 1985, his service as an intelligence officer in the Wehrmacht during World War II raised international controversy.",who was the president of austria
<dbpedia:Kylie_Minogue>,Kylie Minogue,"Kylie Ann Minogue, OBE (/ˈkaɪliː mɨˈnoʊɡ/; born 28 May 1968), often known simply as Kylie, is an Australian-born singer, songwriter, and actress. She achieved recognition by starring in the Australian soap opera Neighbours, where she played tomboy mechanic Charlene Robinson.",who is kylie minogue
<dbpedia:K7>,K7,"K7, K07 or K-7 may refer to: A complete graph with 7 Vertices Bluebird K7, a high speed hydroplane raced by Donald Campbell Daewoo Precision Industries K7, a submachine gun with an integrated suppressor Deep Space Station K7, a fictional space station featured in the Star Trek episodes ""The Trouble With Tribbles"" and ""Trials and Tribble-ations"" K7, a mountain in the Karakoram K-7 (Kansas highway), a state highway in Kansas Kalinin K-7, a heavy experimental aircraft designed and tested in the Soviet Union in the early 1930s Kronprinsens husarregemente, a Swedish Army cavalry regiment disbanded 1927 Pentax K-7, a DSLR camera by Hoya Corporation Schleicher K7, a 2-seater glider plane made from wood and steel",what is k7
<dbpedia:Kellogg–Briand_Pact>,Kellogg–Briand Pact,"The Kellogg–Briand Pact (or Pact of Paris, officially General Treaty for Renunciation of War as an Instrument of National Policy) was a 1928 international agreement in which signatory states promised not to use war to resolve ""disputes or conflicts of whatever nature or of whatever origin they may be, which may arise among them."" Parties failing to abide by this promise ""should be denied of the benefits furnished by this treaty."" It was signed by Germany, France and the United States on August 27, 1928, and by most other nations soon after. @en <http://en.wikipedia.org/wiki/Kellogg–Briand_Pact?oldid=683206345> .
<http://dbpedia.org/resource/Kotoamatsukami> <http://www.w3.org/2000/01/rdf-schema#comment> In Japanese Shinto, Kotoamatsukami (別天津神, literally means ""distinguishing heavenly kami"") is the collective name for the first gods which came into existence at the time of the creation of the universe. They were born in Takamagahara, the world of Heaven at the time of the creation. Unlike the later gods, these deities were born without any procreation.",what was a kellogg-briand agreement in history
<dbpedia:Kansas–Nebraska_Act>,Kansas–Nebraska Act,"The Kansas–Nebraska Act of 1854 (10 Stat. 277) created the territories of Kansas and Nebraska, opening new lands for settlement, and had the effect of repealing the Missouri Compromise of 1820 by allowing white male settlers in those territories to determine through popular sovereignty whether they would allow slavery within each territory. The act was designed by Democratic Senator Stephen A. Douglas of Illinois.",which states were the states made by the kansas nebraska act?
<dbpedia:KA9Q>,KA9Q,"KA9Q, also called KA9Q NOS or simply NOS, was a popular early implementation of TCP/IP and associated protocols for amateur packet radio systems and smaller personal computers connected via serial lines. It was named after the amateur radio callsign of Phil Karn, who first wrote the software for a CP/M system and then ported it to DOS on the IBM PC.",what does a nos signal mean
<dbpedia:Kurfürstendamm>,Kurfürstendamm,"The Kurfürstendamm (colloquially Ku'damm) is one of the most famous avenues in Berlin. The street takes its name from the former Kurfürsten (prince-electors) of Brandenburg. This very broad, long boulevard can be considered the Champs-Élysées of Berlin — full of shops, houses, hotels and restaurants. In particular, many fashion designers have their shops there, as well as several car manufacturers' show rooms.",most famous avenue in berlin
<dbpedia:Kennelly–Heaviside_layer>,Kennelly–Heaviside layer,"The Kennelly–Heaviside layer, named after Arthur E. Kennelly and Oliver Heaviside, also known as the E region or simply the Heaviside layer, is a layer of ionised gas occurring between roughly 90–150 km (56–93 mi) above the ground — one of several layers in the Earth's ionosphere. It reflects medium-frequency radio waves, and because of this reflection, radio waves can be propagated beyond the horizon.Propagation is affected by time of day.",what type of layers are in the kennelly layer
<dbpedia:Kurt_Schwitters>,Kurt Schwitters,"Kurt Hermann Eduard Karl Julius Schwitters (20 June 1887 – 8 January 1948) was a German artist who was born in Hanover, Germany.Schwitters worked in several genres and media, including Dada, Constructivism, Surrealism, poetry, sound, painting, sculpture, graphic design, typography, and what came to be known as installation art. He is most famous for his collages, called Merz Pictures.",where was kurt schwitters born
<dbpedia:Kirlian_photography>,Kirlian photography,Kirlian photography is a collection of photographic techniques used to capture the phenomenon of electrical coronal discharges.,what is kirlian photography
<dbpedia:Karst>,Karst,"Karst topography is a landscape formed from the dissolution of soluble rocks such as limestone, dolomite, and gypsum. It is characterized by underground drainage systems with sinkholes, dolines, and caves. It has also been documented for weathering-resistant rocks, such as quartzite, given the right conditions. Subterranean drainage may limit surface water with few to no rivers or lakes.",what are karst rocks?
<dbpedia:Krupp>,Krupp,"The Krupp family (see pronunciation), a prominent 400-year-old German dynasty from Essen, have become famous for their production of steel, artillery, ammunition, and other armaments. The family business, known as Friedrich Krupp AG, was the largest company in Europe at the beginning of the 20th century. It was important to weapons development and production in both world wars.",largest company in the europe
<dbpedia:Kemerovo>,Kemerovo,"Kemerovo (Russian: Кемерово; IPA: [ˈkʲemʲɪrəvə]) is an industrial city and the administrative center of Kemerovo Oblast, Russia, located at the confluence of the Iskitim and Tom Rivers, in the major coal mining region of the Kuznetsk Basin. Population: 532,981(2010 Census); 484,754 (2002 Census); 520,263 (1989 Census).",where is keremovo
<dbpedia:Hash-based_message_authentication_code>,Hash-based message authentication code,"In cryptography, a keyed-hash message authentication code (HMAC) is a specific construction for calculating a message authentication code (MAC) involving a cryptographic hash function in combination with a secret cryptographic key.  As with any MAC, it may be used to simultaneously verify both the data integrity and the authentication of a message.",what is hmac?
<dbpedia:Khornerstone>,Khornerstone,"In computer performance testing, Khornerstone is a multipurpose benchmark from Workstation Labs used in various periodicals such as UNIX Review.The benchmark consists of 22 separate tests, including public domain components (such as Sieve and Dhrystone) as well as proprietary components. Since it contains proprietary components, the source is not free.",what is khornerstone
<dbpedia:Kent_Applicative_Operating_System>,Kent Applicative Operating System,"The Kent Applicative Operating System is a functional operating system concept to use dynamic process creation and inter-process communication.The system is based on earlier work by Will R. Stoye and developed by Dr. John Cupitt as the thrust of his PhD thesis at the University of Kent, in 1989. The system allow dynamic creation of functional processes. Processes are stream processors, functions that transform an ingoing to an outgoing stream.",what is kent applicative operating system
<dbpedia:Channels_of_the_Hawaiian_Islands>,Channels of the Hawaiian Islands,"In an archipelago like the Hawaiian Islands the water between islands is typically called a channel or passage. Described here are the channels between the islands of Hawaiʻi, arranged from southeast to northwest.",what type of water is in the hawaiian islands
<dbpedia:Karaoke>,Karaoke,"Karaoke (カラオケ, bimoraic clipped compound of Japanese kara 空 ""empty"" and ōkesutora オーケストラ ""orchestra"") (/ˌkæriˈoʊki/ or /ˌkærəˈoʊki/; Japanese: [kaɽaoke]) is a form of interactive entertainment or video game in which an amateur singer sings along with recorded music (a music video) using a microphone and public address system. The music is typically a well-known popular song minus the lead vocal.",what is kaaoke?
<dbpedia:KHAD>,KHAD,"Khadamat-e Aetla'at-e Dawlati (Pashto/Persian 'خدمات اطلاعات دولتی') translates directly to English as: ""State Intelligence Agency"".  However, this phrase is more precisely translated as ""State Information Services"". Khadamat-e Aetela'at-e Dawlati, almost always known by its acronym KHAD (or KhAD), is the main security agency and intelligence agency of Afghanistan, and also served as the secret police during the Soviet occupation.",khad definition
<dbpedia:Kent_State_University>,Kent State University,"Kent State University (also known as Kent, Kent State, and KSU) is a public research university in Kent, Ohio, United States. In addition to the main campus in Kent, which is the largest and oldest campus and serves as the administrative center, Kent State operates seven regional campuses in Northeast Ohio and additional facilities in the region and internationally.",where is kent state
<dbpedia:Killer_poke>,Killer poke,"In computer jargon, a killer poke is a method of inducing physical hardware damage on a machine and/or its peripherals by the insertion of invalid values, via, for example, BASIC's POKE command, into a memory-mapped control register. The term is typically used to describe a family of fairly well known tricks that can overload the analog electronics in the CRT monitors of computers lacking hardware sanity checking (notable examples being the IBM Portable and Commodore PET.)",what is a killer poke
<dbpedia:Key_frame>,Key frame,"A key frame in animation and filmmaking is a drawing that defines the starting and ending points of any smooth transition. The drawings are called ""frames"" because their position in time is measured in frames on a strip of film. A sequence of key frames defines which movement the viewer will see, whereas the position of the key frames on the film, video, or animation defines the timing of the movement.",what is a key frame
<dbpedia:Kinsey_Reports>,Kinsey Reports,"The Kinsey Reports are two books on human sexual behavior: Sexual Behavior in the Human Male (1948) and Sexual Behavior in the Human Female (1953), written by Alfred Kinsey, Wardell Pomeroy and others and published by Saunders.",who wrote the kinsey reports?
<dbpedia:Killer_micro>,Killer micro,"A killer micro is a microprocessor-based machine that infringes on mini, mainframe, or supercomputer performance turf. It originally referred to the replacement of vector supercomputers built with bipolar technology by Massively Parallel Processors (MPP) assembled from a larger number of lower performing microprocessors.",killer micro definition computer
<dbpedia:Key_escrow>,Key escrow,"Key escrow (also known as a “fair” cryptosystem) is an arrangement in which the keys needed to decrypt encrypted data are held in escrow so that, under certain circumstances, an authorized third party may gain access to those keys.",what is a escrow fsi
<dbpedia:Kipsigis_people>,Kipsigis people,"The Kipsigis are a Nilotic ethnic group of Kenya. Their first language is Kipsigis, which belongs to the Nilo-Saharan language family. The traditional occupation of the Kipsigis is herding. In pre-colonial Kipsigis society, there was a warrior element. Living on the Western Highlands at an altitude of 1500 to 2000m, the Kipsigis now also grow maize, wheat, pyrethrum and tea.",what is kipsigis
<dbpedia:Kaleidoscope>,Kaleidoscope,"A kaleidoscope is a cylinder with mirrors containing loose, colored objects  such as beads or pebbles and bits of glass. As the viewer looks into one end, light entering the other end creates a colorful pattern, due to the reflection off the mirrors.",what are kaleidoscopes
<dbpedia:Kundalini>,Kundalini,"Kundalini (Sanskrit kuṇḍalinī, कुण्डलिनी, About this sound pronunciation , ""coiled one""), in yogic practice, is an energy, or shakti, starting out coiled at the base of the spine. Kundalini is a tool used for the purpose of reaching spiritual enlightenment. The Kundalini is described as being ""coiled"" at the base of the spine, represented as either a goddess or sleeping serpent waiting to be awakened.",what is kundalini yogic
<dbpedia:Protea_cynaroides>,Protea cynaroides,"The king protea (Protea cynaroides) is a flowering plant. It is a distinctive member of Protea, having the largest flower head in the genus. The species is also known as giant protea, honeypot or king sugar bush. It is widely distributed in the southwestern and southern parts of South Africa in the fynbos region.The king protea is the national flower of South Africa.",what is a king protea
<dbpedia:Kill_file>,Kill file,"A kill file (also killfile, bozo bin or twit list) is a per-user file used by some Usenet reading programs (originally Larry Wall's rn) to discard summarily (without presenting for reading) articles matching some unwanted patterns of subject, author, or other header lines.Thus to add a person (or subject) to one's kill file is to arrange for that person to be ignored by one's newsreader in the future. By extension, it may be used for a decision to ignore the person or subject in other media.",what is kill file
<dbpedia:Kenesaw_Mountain_Landis>,Kenesaw Mountain Landis,"Kenesaw Mountain Landis (/ˈkɛnɨsɔː ˈmaʊntɨn ˈlændɨs/; November 20, 1866 – November 25, 1944) was an American jurist who served as a federal judge from 1905 to 1922 and as the first Commissioner of Baseball from 1920 until his death. He is remembered for his handling of the Black Sox scandal, in which he expelled eight members of the Chicago White Sox from organized baseball for conspiring to lose the 1919 World Series and repeatedly refused their reinstatement requests.",what years was kenesaw mountain landis in office
<dbpedia:Kesgrave>,Kesgrave,Kesgrave is a suburb containing two large estates in the English county of Suffolk on the eastern edge of Ipswich.,what county is kesgrave suffolk in
<dbpedia:Katal>,Katal,"The katal (symbol: kat) is the SI unit of catalytic activity. It is a derived SI unit for quantifying the catalytic activity of enzymes (measuring  the enzymatic activity level in enzyme catalysis) and other catalysts. Its use is recommended by the General Conference on Weights and Measures and other international organizations. It replaces the non-SI enzyme unit. Enzyme units are, however, still more commonly used than the katal in practice at present, especially in biochemistry.",what is katal
<dbpedia:Kington_Magna>,Kington Magna,"Kington Magna is a village and civil parish in the Blackmore Vale in the English county of Dorset, situated about 3.5 miles (5.6 km) south-west of the town of Gillingham, in the North Dorset administrative district.",where is kington magna
<dbpedia:Kipper>,Kipper,"A kipper is a whole herring, a small, oily fish, that has been split in butterfly fashion from tail to head along the dorsal ridge, gutted, salted or pickled, and cold-smoked over smouldering woodchips (typically oak).In the United Kingdom, Isle of Man, Japan, and a minority of North American regions they are often eaten for breakfast.",what is a kipper
<dbpedia:FX-87>,FX-87,"FX-87 is a polymorphic typed functional language based on a system for static program analysis in which every expression has two static properties: a type and an effect. In a study done by MIT, FX-87 yields similar performance results as functional languages on programs that do not contain side effects (Fibonacci, Factorial). FX-87 did yield a great performance increase when matching DNA sequences.KFX is the kernel language of FX-87. It was described in 'Polymorphic Effect Systems', J.M.",what is fx87
<dbpedia:KISS_(system)>,KISS (system),KISS is an early low-level programming language on the IBM 650 business computer. It was listed in the Communications of the ACM 2(5):16 (May 1959).,what is miss
<dbpedia:Kaluza–Klein_theory>,Kaluza–Klein theory,"In physics, Kaluza–Klein theory (KK theory) is a unified field theory of gravitation and electromagnetism built around the idea of a fifth dimension beyond the usual four of space and time.  It is considered to be an important precursor to string theory.The five-dimensional theory was developed in three steps. The original hypothesis came from Theodor Kaluza, who sent his results to Einstein in 1919, and published them in 1921.",which theory is most widely used in physics?
<dbpedia:Kemp_Town>,Kemp Town,"Kemp Town is a 19th Century residential estate in the east of Brighton in East Sussex, England, UK. Conceived and financed by Thomas Read Kemp it has given its name to the larger Kemptown region of Brighton. The majority of the original estate is now demarcated by the modern Kemp Town Conservation Area as defined by the local authority, Brighton and Hove City Council.The estate was designed by Charles Busby and Amon Henry Wilds and constructed by Thomas Cubitt.",where is kpk town
<dbpedia:Klamath_people>,Klamath people,"The Klamath people are a Native American tribe of the Plateau culture area in Southern Oregon and Northern California. Today Klamath people are enrolled in the federally recognized tribes: Klamath Tribes, Oregon Quartz Valley Indian Community, California.",where are klamath people
<dbpedia:KL1>,KL1,"KL1, or Kernel Language 1 is an experimental AND-parallel version of KL0 developed for the ICOT Fifth Generation Computer project. KL1 is an implementation of Flat GHC (a subset of the Guarded Horn Clauses language by Kazunori Ueda), making it a parallelised Prolog variant.",what is the kl language
<dbpedia:Kingfisher>,Kingfisher,"Kingfishers are a group of small to medium-sized brightly colored birds in the order Coraciiformes. They have a cosmopolitan distribution, with most species found outside of the Americas. The group is treated either as a single family, Alcedinidae, or as a suborder Alcedines containing three families, Alcedinidae (river kingfishers), Halcyonidae (tree kingfishers), and Cerylidae (water kingfishers). There are roughly 90 species of kingfisher.",what is a kingfisher
<dbpedia:Karel_Hynek_Mácha>,Karel Hynek Mácha,Karel Hynek Mácha (Czech pronunciation: [ˈkarɛl ˈɦɪnɛk ˈmaːxa]) (16 November 1810 – 6 November 1836) was a Czech romantic poet.,who is karel macha
<dbpedia:Kilobit>,Kilobit,The kilobit is a multiple of the unit bit for digital information or computer storage.,what is kilobit
<dbpedia:Knife>,Knife,"A knife (plural knives) is a tool with a cutting edge or blade, hand-held or otherwise, with most having a handle.  Some types of knives are used as utensils, including knives used at the dining table (e.g., butter knives and steak knives) and knives used in the kitchen (e.g., paring knife, bread knife, cleaver). Many types of knives are used as tools, such as the utility knife carried by soldiers, the pocket knife carried by hikers and the hunting knife used by hunters.",what does knife mean
<dbpedia:Karnataka>,Karnataka,"Karnataka /kɑrˈnaːtəkə/ is a state in south western region of India. It was formed on 1 November 1956, with the passage of the States Reorganisation Act. Originally known as the State of Mysore, it was renamed Karnataka in 1973.  The capital and largest city is Bangalore (Bengaluru).",where is karnataka located in india
<dbpedia:Keilhauite>,Keilhauite,"Keilhauite (also known as yttrotitanite) is a variety of the mineral titanite of a brownish black color, related to titanite in form. It consists chiefly of silicon dioxide, titanium dioxide, calcium oxide, and yttrium oxide.Keilhauite has a chemical formula of (CaTi,Al2,Fe23+,Y23+)SiO5. It differs from titanite only in that calcium is substituted by up to 12 percent (Y,Ce)2O3.",what is keilhauite
<dbpedia:Kariba_Dam>,Kariba Dam,"The Kariba Dam is a hydroelectric dam in the Kariba Gorge of the Zambezi river basin between Zambia and Zimbabwe. The dam stands 128 metres (420 ft) tall and 579 metres (1,900 ft) long. The dam forms Lake Kariba which extends for 280 kilometres (170 mi) and holds 185 cubic kilometres (150,000,000 acre·ft) of water.",where is kariba dam
<dbpedia:Knud_Rasmussen>,Knud Rasmussen,"Knud Johan Victor Rasmussen (June 7, 1879 – December 21, 1933) was a Danish polar explorer and anthropologist. He has been called the ""father of Eskimology"" and was the first European to cross the Northwest Passage via dog sled. He remains well known in Greenland, Denmark and among Canadian Inuit.",what was the name of the first polar explorer
<dbpedia:KOMPILER>,KOMPILER,"In computing, the KOMPILER was one of the first language compilation and runtime systems for International Business Machines' IBM 701, the fastest commercial U.S. computer available in 1955.Information on KOMPILER is listed on page 16 of Volume 2, Number 5 (May 1959) of the Communications of the ACM. Known versions are KOMPILER 2 for IBM 701 and KOMPILER 3 for the IBM 704. KOMPILER was eventually replaced by a Fortran compiler on the IBM 704.",what was the definition of a kooper
<dbpedia:Kamacite>,Kamacite,"Kamacite is an alloy of iron and nickel, which is found on earth only in meteorites. The proportion  iron:nickel is between 90:10 to 95:5; small quantities of other elements, such as cobalt or carbon may also be present. The mineral has a metallic luster, is gray and has no clear cleavage although the structure is isometric-hexoctahedral. Its density is around 8 g/cm³ and its hardness is 4 on the Mohs scale.",what is kamatarite
<dbpedia:Kentucky>,Kentucky,"Kentucky /kɨnˈtʌki/, officially the Commonwealth of Kentucky, is a state located in the east south-central region of the United States. Kentucky is one of four U.S. states constituted as a commonwealth (the others being Virginia, Pennsylvania, and Massachusetts). Originally a part of Virginia, in 1792 Kentucky became the 15th state to join the Union.",where is ky located
