_id,title,text,query
<dbpedia:Lighthouse_of_Alexandria>,Lighthouse of Alexandria,"The Lighthouse of Alexandria, sometimes called the Pharos of Alexandria (/ˈfɛərɒs/; Ancient Greek: ὁ Φάρος τῆς Ἀλεξανδρείας), was a lighthouse built by the Ptolemaic Kingdom between 280 and 247 BC which was between 393 and 450 ft (120 and 137 m) tall. It was one of the tallest man-made structures in the world for many centuries, and was regarded as one of the Seven Wonders of the Ancient World. Badly damaged by three earthquakes between AD 956 and 1323, it then became an abandoned ruin.",what was the tallest lighthouse
<dbpedia:Foreign_relations_of_Laos>,Foreign relations of Laos,"The foreign relations of Laos, after the takeover by the Pathet Lao in December 1975, were characterized by a hostile posture toward the West, with the government of the Lao People's Democratic Republic aligning itself with the Soviet bloc, maintaining close ties with the Soviet Union and depending heavily on the Soviets for most of its foreign assistance.",what year did pathet laos take over
<dbpedia:Latvian_National_Armed_Forces>,Latvian National Armed Forces,"The  Latvian National Armed Forces (Latvian: Nacionālie Bruņotie Spēki) are the armed forces of the Republic of Latvia. Latvia's defense concept is based on a mobile professional rapid response force and large reserve segment of around 12000 personal that can be called upon relatively fast for mobilization should need arise. The National Armed Forces consists of Land Forces, Naval Forces, Air Force, National Guard and others.",what are the forces of the latvian state
<dbpedia:Line_Islands>,Line Islands,"The Line Islands, Teraina Islands or Equatorial Islands, is a chain of eleven atolls and low coral islands in the central Pacific Ocean, south of the Hawaiian Islands, that stretches for 2,350 km in a northwest-southeast direction, making it one of the longest island chains of the world.",which chain of islands has the longest and longest coastline?
<dbpedia:Limestone>,Limestone,"Limestone is a sedimentary rock composed largely of the minerals calcite and aragonite, which are different crystal forms of calcium carbonate (CaCO3).  Most limestone is composed of skeletal fragments of marine organisms such as coral, forams and molluscs.Limestone makes up about 10% of the total volume of all sedimentary rocks.  The solubility of limestone in water and weak acid solutions leads to karst landscapes, in which water erodes the limestone over thousands to millions of years.",what minerals is limestone composed of
<dbpedia:Linus_Torvalds>,Linus Torvalds,"Linus Benedict Torvalds (/ˈlaɪnəsˈtɔrvɔːldz/; Swedish: [ˈliːn.ɵs ˈtuːr.valds]; born December 28, 1969) is a Finnish American software engineer, who was the principal force behind the development of the Linux kernel that became the most popular kernel for operating systems, like GNU and  Android. He later became the chief architect of the Linux kernel and now acts as the project's coordinator. He also created the distributed revision control system git.",what is linus torvalds
<dbpedia:Libya>,Libya,"Libya (Arabic: ليبيا‎ Lībyā) is a country in the Maghreb region of North Africa bordered by the Mediterranean Sea to the north, Egypt to the east, Sudan to the southeast, Chad and Niger to the south, and Algeria and Tunisia to the west. The three traditional parts of the country are Tripolitania, Fezzan and Cyrenaica. With an area of almost 1.8 million square kilometres (700,000 sq mi), Libya is the fourth largest country in Africa, and is the 17th largest country in the world.",what region is libya in?
<dbpedia:History_of_Latvia>,History of Latvia,"The History of Latvia began around 9000 BC with the end of the last glacial period in northern Europe. Ancient Baltic peoples appeared during the second millennium BC, and four distinct tribal realms in Latvia's territories were identifiable towards the end of the first millennium AD.",when did lettonians first appear
<dbpedia:Louvre>,Louvre,"The Louvre or the Louvre Museum (French: Musée du Louvre, pronounced: [myze dy luvʁ]) is one of the world's largest museums and a historic monument in Paris, France. A central landmark of the city, it is located on the Right Bank of the Seine in the 1st arrondissement (ward). Nearly 35,000 objects from prehistory to the 21st century are exhibited over an area of 60,600 square metres (652,300 square feet).",largest museums in france
<dbpedia:Politics_of_Laos>,Politics of Laos,"The politics of Laos takes place in the framework of a single-party socialist republic. The only legal political party is the Lao People's Revolutionary Party (LPRP). The head of state is President Choummaly Sayasone, who also is LPRP general secretary. The head of government is Prime Minister Thongsing Thammavong. Government policies are determined by the party through the all-powerful nine-member Politburo of the Lao People's Revolutionary Party and the 49-member Central Committee.",how is laos political?
<dbpedia:Kurds>,Kurds,"The Kurds (Kurdish: کورد‎ Kurd) are an ethnic group in the Middle East, mostly inhabiting a contiguous area spanning adjacent parts of southeastern Turkey (Northern or Turkish Kurdistan), western Iran (Eastern or Iranian Kurdistan), northern Iraq (Southern or Iraqi Kurdistan), and northern Syria (Western Kurdistan or Rojava). The Kurds have ethnically diverse origins.",kurds definition
<dbpedia:History_of_Laos>,History of Laos,"Laos emerged from the French Colonial Empire as an independent country in 1953. Laos exists in truncated form from the thirteenth century Lao kingdom of Lan Xang. Lan Xang existed as a unified kingdom from 1357-1707, divided into the three rival kingdoms of Luang Prabang, Vientiane, and Champasak from 1707-1779, fell to Siamese suzerainty from 1779-1893, and was reunified under the French Protectorate of Laos in 1893.",who is laos
<dbpedia:Leo_(constellation)>,Leo (constellation),"Leo /ˈliːoʊ/ is one of the constellations of the zodiac, lying between Cancer to the west and Virgo to the east. Its name is Latin for lion, and to the ancient Greeks represented the Nemean Lion killed by the mythical Greek hero Heracles (known to the ancient Romans as Hercules) as one of his twelve labors. Its symbol is 20px ( ♌).",what constellation is leo
<dbpedia:Transport_in_Latvia>,Transport in Latvia,This article provides an overview of the transport infrastructure of Latvia.,transport infrastructure in lettonia
<dbpedia:Geography_of_Latvia>,Geography of Latvia,"Geographic coordinates:57°00′N 25°00′ELatvia lies on the eastern shores of the Baltic Sea on the level northwestern part of the rising East European platform, between Estonia and Lithuania. About 98% of the country lies under 200 m (656 ft) elevation. With the exception of the coastal plains, the ice age divided Latvia into three main regions: the morainic Western and Eastern uplands and the Middle lowlands.",where is latvia located
<dbpedia:Lionhead_Studios>,Lionhead Studios,"Lionhead Studios is a British video game developer, formerly led by Peter Molyneux. It was acquired by Microsoft Studios in April 2006. Lionhead started as a breakaway from the developer Bullfrog, which was also founded by Molyneux. Lionhead's first game was Black & White, a god game with elements of artificial life and strategy games. Black & White was published by Electronic Arts in 2001.",who makes lionhead
<dbpedia:Leni_Riefenstahl>,Leni Riefenstahl,"Helene Bertha Amalie ""Leni"" Riefenstahl (German: [ˈʁiːfənʃtaːl]; 22 August 1902 – 8 September 2003) was a German film director, producer, screenwriter, editor, photographer, actress and dancer.Born in 1902 into a Protestant family, Riefenstahl grew up alongside her brother Heinz in Germany, who was later killed in World War II.",who is leni
<dbpedia:Library>,Library,"A library is a collection of sources of information and similar resources, made accessible to a defined community for reference or borrowing. It provides physical or digital access to material, and may be a physical building or room, or a virtual space, or both. A library's collection can include books, periodicals, newspapers, manuscripts, films, maps, prints, documents, microform, CDs, cassettes, videotapes, DVDs, Blu-ray Discs, e-books, audiobooks, databases, and other formats.",definition of library
<dbpedia:Transport_in_Lebanon>,Transport in Lebanon,Transportation in Lebanon varies greatly in quality from the ultramodern Beirut International Airport to poor road conditions in many parts of the country. The Lebanese civil war between 1975 and 1990 and the 2006 Lebanon War with Israel severely damaged the country's infrastructure.,what type of transport is in lebanon
<dbpedia:Locomotive>,Locomotive,"A locomotive or engine is a rail transport vehicle that provides the motive power for a train. The word originates from the Latin loco – ""from a place"", ablative of locus, ""place"" + Medieval Latin motivus, ""causing motion"", and is a shortened form of the term locomotive engine, first used in the early 19th century to distinguish between mobile and stationary steam engines.A locomotive has no payload capacity of its own, and its sole purpose is to move the train along the tracks.",what is a locomotive?
<dbpedia:Geography_of_Laos>,Geography of Laos,"Laos is a landlocked nation in Southeast Asia, northeast of Thailand, west of Vietnam, that covers 236,800 square kilometers in the center of the Southeast Asian peninsula, is surrounded by  Burma (Myanmar), Cambodia, the People's Republic of China, Thailand, and Vietnam. Its location has often made it a buffer between more powerful neighboring states, as well as a crossroads for trade and communication.",what is the geographical location of laos
<dbpedia:Latin_hip_hop>,Latin hip hop,Latin hip hop or Latin rap is hip hop music recorded by artists of Latin American and Iberian (Spain and Portugal) origin.,where was hip hop originated
<dbpedia:Ignoratio_elenchi>,Ignoratio elenchi,"Ignoratio elenchi, also known as irrelevant conclusion, is the informal fallacy of presenting an argument that may or may not be logically valid, but fails nonetheless to address the issue in question.  More colloquially, it is also known as missing the point.Ignoratio elenchi falls into the broad class of relevance fallacies. It is one of the fallacies identified by Aristotle in his Organon.",what is the definition of ignoratio elenchi
<dbpedia:Luxembourg>,Luxembourg,"Luxembourg /ˈlʌksəmbɜrɡ/ (Luxembourgish: Lëtzebuerg; German: Luxemburg), officially the Grand Duchy of Luxembourg, is a landlocked country in western Europe. It is bordered by Belgium to the west and north, Germany to the east, and France to the south. It comprises two principal regions: the Oesling in the north as part of the Ardennes massif, and the Gutland ""\good country"") in the south. With an area of 2,586 square kilometres (998 sq mi), it is one of the smallest sovereign states in Europe.",what part of europe is luxembourg
<dbpedia:Telecommunications_in_Latvia>,Telecommunications in Latvia,"Telecommunications in Latvia include radio, television, fixed and mobile telephones, and the Internet.",what is telecommunication
<dbpedia:Forever_Changes>,Forever Changes,Forever Changes is the third album by the American rock band Love.,what is forever changes?
<dbpedia:Slippery_slope>,Slippery slope,"In logic and critical thinking, a slippery slope is a logical device, but it is usually known under its fallacious form, in which a person asserts that some event must inevitably follow from another without any rational argument or demonstrable mechanism for the inevitability of the event in question.",definition for slippery slope
<dbpedia:Melissa_officinalis>,Melissa officinalis,"Melissa officinalis, known as lemon balm, balm, common balm,  or balm mint, is a perennial herbaceous plant in the mint family Lamiaceae, native to south-central Europe, North Africa, the Mediterranean region, and Central Asia.It grows to 70–150 cm (28–59 in) tall. The leaves have a gentle lemon scent, related to mint. During summer, small white flowers full of nectar appear. It is not to be confused with bee balm (which is genus Monarda).",is balm a herbaceous plant
<dbpedia:Kathmandu>,Kathmandu,"Kathmandu (/ˌkɑːtmɑːnˈduː/; Nepali pronunciation: [kɑʈʰmɑɳɖu]), (Nenglish: Catmandoo), is the capital and largest municipality of Nepal. It is also considered as capital of South Asia and holds headquarter of SAARC. It is the only city of Nepal with the administrative status of Mahanagar (Metropolitan City), as compared to Upa-Mahanagar (Sub-Metropolitan City) or Nagar (City).",where is kandaludu
<dbpedia:Telecommunications_in_Lebanon>,Telecommunications in Lebanon,"This article concerns the systems of communication in Lebanon.  Lebanon possesses a number of systems of telecommunication, some of which are currently being reconstructed following damage during the civil war that ended in 1991. The country code and top-level domain for Lebanon is \.lb\"".""",which country uses telecommunications
<dbpedia:Transport_in_Lesotho>,Transport in Lesotho,"This article concerns systems of transport in Lesotho.  As a landlocked country, Lesotho has no seaports or harbours, but does possess road, air, and limited rail infrastructure.",how is lesotho transport connected to the land
<dbpedia:Demographics_of_Lesotho>,Demographics of Lesotho,"This article is about the demographic features of the population of Lesotho, including population density, ethnicity, education level, health of the populace, economic status, religious affiliations and other aspects of the population.The Demographics of Lesotho describe the condition and overview of Lesotho's peoples. Demographic topics include basic education, health, and population statistics as well as identified racial and religious affiliations.",what are demographic characteristics of lesotho
<dbpedia:History_of_Lebanon>,History of Lebanon,"The history of Lebanon covers the history of the modern Republic of Lebanon and the earlier emergence of Greater Lebanon under the French Mandate for Syria and Lebanon, as well as the previous history of the region, covered by the modern state.",what is history of lebanon
<dbpedia:Geography_of_Liberia>,Geography of Liberia,"Liberia is a Sub-Saharan nation in West Africa located at 6 °N, 9 °W. It borders the north Atlantic Ocean to the southwest (580 kilometres (360 mi) of coastline) and three other African nations on the other three sides.In total, Liberia comprises 110,000 square kilometres (43,000 sq mi) of which 96,300 square kilometres (37,190 sq mi) is land and 15,000 square kilometres (5,810 sq mi) is water.",how big is liberia
<dbpedia:Politics_of_Lesotho>,Politics of Lesotho,"Politics of Lesotho takes place in a framework of a parliamentary representative democratic constitutional monarchy, whereby the Prime Minister of Lesotho is the head of government, and of a  multi-party system. Executive power is exercised by the government. Legislative power is vested in both the government and the two chambers of Parliament, the Senate and the National Assembly. The Judiciary is independent of the executive and the legislature.",what type of government does lesotho have?
<dbpedia:Communications_in_Libya>,Communications in Libya,"Communications in Libya describes the overall environment for the radio, television, telephone, Internet, and newspaper markets in Libya.The control of the media by Colonel Gaddafi's regime came to an end after the fall of Tripoli in August 2011, resulting in a mushrooming of new media outlets. Journalists are experiencing unprecedented freedom. Libya has not yet adopted a media law, and there are no clear legal guidelines on libel and slander, or a code of ethics for journalists.",is there a law for journalists in libya
<dbpedia:Telecommunications_in_Liechtenstein>,Telecommunications in Liechtenstein,"This article concerns the systems of communications in Liechtenstein.  Liechtenstein possesses a number of modern communications systems, some of which are shared with the neighbouring country of Switzerland.  The country code and top-level domain for Liechtenstein is .li.",what is the code for liechtenstein
<dbpedia:Telecommunications_in_Lesotho>,Telecommunications in Lesotho,"Telecommunications in Lesotho include radio, television, print and online newspapers, fixed and mobile telephones, and the Internet.",what is lesotho like
<dbpedia:Demographics_of_Lithuania>,Demographics of Lithuania,"This article is about the demographic features of the population of Lithuania, including population density, ethnicity, level of education, health, economic status, and religious affiliations.",what is the population in litau
<dbpedia:Demographics_of_Liechtenstein>,Demographics of Liechtenstein,"This article is about the demographic features of the population of Liechtenstein, including population density, ethnicity, education level, health of the populace, economic status, religious affiliations and other aspects of the population.Liechtenstein is the fourth smallest country of Europe, after the Vatican City, Monaco, and San Marino.",what is the population of litauenstein
<dbpedia:Telecommunications_in_Lithuania>,Telecommunications in Lithuania,"This article provides an overview of telecommunications in Lithuania, including radio, television, telephones, and the Internet.The Communications Regulatory Authority of the Republic of Lithuania (RRT) is Lithuania's independent communications-industry regulator. It was established under the Law on Telecommunications and the provisions of the European Union Directives to ensure that the industry remain competitive.",what is the name of the regulator of telecommunication in lituania
<dbpedia:Communications_in_Liberia>,Communications in Liberia,"Communications in Liberia include the press, radio, television, fixed and mobile telephones, and the Internet.Much of Liberia's communications infrastructure was destroyed or plundered during the two civil wars (1989-1996 and 1999-2003).",what is a communications system in liberia
<dbpedia:Transport_in_Lithuania>,Transport in Lithuania,"This article provides an overview of the transport infrastructure of Lithuania. For transport in the Soviet Union, see Transport in the Soviet Union.",what is the infrastructure of litau
<dbpedia:Louis_Pasteur>,Louis Pasteur,"Louis Pasteur (/ˈluːi pæˈstɜr/, French: [lwi pastœʁ]; December 27, 1822 – September 28, 1895) was a French chemist and microbiologist renowned for his discoveries of the principles of vaccination, microbial fermentation and pasteurization. He is remembered for his remarkable breakthroughs in the causes and preventions of diseases, and his discoveries have saved countless lives ever since. He reduced mortality from puerperal fever, and created the first vaccines for rabies and anthrax.",who is louis pasteur
<dbpedia:Laos>,Laos,"Laos ((/ˈlaʊs/, /ˈlɑː.ɒs/, /ˈlɑː.oʊs/, or /ˈleɪ.ɒs/) Lao: ສາທາລະນະລັດ ປະຊາທິປະໄຕ ປະຊາຊົນລາວ, pronounced [sǎːtʰáːlanalat pásáːtʰipátàj pásáːsón láːw] Sathalanalat Paxathipatai Paxaxon Lao), officially the Lao People's Democratic Republic (LPDR) (French: République démocratique populaire lao), is a landlocked country in Southeast Asia, bordered by Myanmar (Burma) and the People's Republic of China to the northwest, Vietnam to the east, Cambodia to the south, and Thailand to the west.",what is laos
<dbpedia:Economy_of_Laos>,Economy of Laos,"The economy of the Lao Peoples' Democratic Republic is rapidly growing, as the government began to decentralise control and encourage private enterprise in 1986. Currently, the economy grows at 8% a year, and the government is pursuing poverty reduction and education for all children as key goals.",what is laos economic system
<dbpedia:Geography_of_Libya>,Geography of Libya,"Libya is fourth in size among the countries of Africa and seventeenth among the countries of the world. It is on the Mediterranean between Egypt and Tunisia, with Niger and Chad to the south and Sudan to the southeast. Although the oil discoveries of the 1960s have brought immense wealth, at the time of its independence it was an extremely poor desert state whose only important physical asset appeared to be its strategic location at the midpoint of Africa's northern rim.",what are the major advantages of libya
<dbpedia:Transport_in_Liberia>,Transport in Liberia,"Transport in Liberia consist of railways, highways, seaports and airports.",what are the roads in liberia
<dbpedia:Demographics_of_Liberia>,Demographics of Liberia,"The demographics of Liberia are examined on this page, including Liberia's population density, ethnic groups, education level, population health, economic status, religious affiliations and other demographic information.As of 2006, Liberia has the highest population growth rate in the world (4.50% per annum). 43.5% of Liberians were below the age of 15 in 2010.With recent civil wars being fought along ethnic lines, Liberia is a multiethnic and multicultural country.",what is the population of liberia
<dbpedia:Geography_of_Luxembourg>,Geography of Luxembourg,"Luxembourg is a small country located in the Low Countries, part of North-West Europe  It borders Belgium for 148 km (91 mi) to the west and north, France (23 km) (45 mi) to the south, and Germany (138 km) (85 mi) to the east.  Luxembourg is landlocked, separated from the North Sea by Belgium.The topography of the country is divided very clearly between the hilly Oesling of the northern third of the Grand Duchy and the flat Gutland, which occupies the southern two-thirds.",where is luxembourg
<dbpedia:History_of_Lesotho>,History of Lesotho,"The area now known as Lesotho /lɪˈsuːtuː/ goes back as many as 40,000 years. The present Lesotho (then called Basutoland) emerged as a single polity under paramount chief Moshoeshoe I in 1822. Under Moshoeshoe I, Basutoland joined other tribes in their struggle against the Lifaqane associated with the reign of Shaka Zulu from 1818 to 1828.Subsequent evolution of the state was shaped by contact with the British and Dutch colonists from Cape Colony.",why is lesotho known as basutoland
"<dbpedia:Kansas_City,_Missouri>","Kansas City, Missouri","Kansas City, or K.C., is the largest city in the state of Missouri. It is the 37th–largest city by population in the United States and the 23rd–largest by area. It is the central city of the Kansas City metropolitan area, which spans the Kansas–Missouri border. It was founded in the 1830s as a Missouri River port at its confluence with the Kansas River coming in from the west. Originally called Kansas after the river, this became confusing upon the establishment of Kansas Territory in 1854.",is kansas city missouri the largest city
<dbpedia:Geography_of_Lebanon>,Geography of Lebanon,"Lebanon is part of the Middle East, located at approximately 35˚N, 35˚E. Stretching along the eastern shore of the Mediterranean Sea, its length almost three times its width. As it stretches from north to south, the width of its terrain becomes narrower.",where is lebanon?
<dbpedia:Latin>,Latin,"Latin (/ˈlætɨn/; Latin: lingua latīna, IPA: [ˈlɪŋɡʷa laˈtiːna]) is a classical language belonging to the Italic branch of the Indo-European languages. The Latin alphabet is derived from the Etruscan and Greek alphabets.Latin was originally spoken in Latium, Italy. Through the power of the Roman Republic, it became the dominant language, initially in Italy and subsequently throughout the Roman Empire.",what is latin
<dbpedia:Large_technical_system>,Large technical system,"A large technical system (LTS) is a system or network of enormous proportions or complexity.  The study of LTSs is a subdiscipline of history of science and technology.The book Rescuing Prometheus by Thomas P. Hughes documents the development of four such systems, including the Boston central artery tunnel and the Internet.",what is an LTS
<dbpedia:Kuomintang>,Kuomintang,"The Kuomintang of China (/ˌkwoʊmɪnˈtɑːŋ/ or /-ˈtæŋ/; KMT), or sometimes spelled as Guomindang (/ˌɡwoʊmɪnˈdɑːŋ/; GMD) by its Pinyin transliteration, is a political party in the Republic of China (ROC). It is the current ruling political party in Taiwan. The name is often translated as the Chinese Nationalist Party.The predecessor of the KMT, the Revolutionary Alliance, was one of the major advocates of the overthrow of the Qing Dynasty and the establishment of a republic.",who is the kuomintang
<dbpedia:Foreign_relations_of_Liechtenstein>,Foreign relations of Liechtenstein,"Liechtenstein's foreign economic policy has been dominated by its customs union with Switzerland (and with Austria-Hungary until World War I). This union also led to its independent membership in the European Free Trade Association (EFTA) in 1991. Unlike Switzerland however (where citizens rejected membership in a referendum), Liechtenstein is part of the European Economic Area.Liechtenstein was admitted to the United Nations in 1990.",is echtenstein part of efta
<dbpedia:Geography_of_Lithuania>,Geography of Lithuania,"Lithuania is a country in Northern Europe, most populous of the Baltic states, Lithuania has 262 kilometres (163 mi) of coastline consisting of the continental coast and the ""Curonian Spit"" coast.",where is litauania
