_id,title,text,query
<dbpedia:Ian_Botham>,Ian Botham,"Sir Ian Terence Botham, OBE (born 24 November 1955) is a former England Test cricketer and Test team captain, and current cricket commentator. He was a genuine all-rounder with 14 centuries and 383 wickets in Test cricket, and remains well known by his nickname \Beefy\"".""",who is ian botham
<dbpedia:Jazz_guitar>,Jazz guitar,"The term jazz guitar may refer to either a type of guitar or to the variety of guitar playing styles used in the various genres which are commonly termed ""jazz"". The jazz-type guitar was born as a result of using electric amplification to increase the volume of conventional acoustic guitars.Conceived in the early 1930s, the electric guitar became a necessity as jazz musicians sought to amplify their sound to be heard over big bands.",what is the jazz guitar
<dbpedia:Javary_River>,Javary River,"The Javary River, Javari River or Yavarí River (Spanish: Río Yavarí; Portuguese: Rio Javari) is a 1,184 km (736 mi) tributary of the Amazon that forms the boundary between Brazil and Peru for more than 500 mi (800 km). It is navigable by canoe for 900 mi (1,400 km) from above its mouth to its source in the Ucayali highlands, but only 260 were found suitable for steam navigation. The Brazilian Boundary Commission ascended it in 1866 to the junction of the Shino with its Jaquirana branch.",what river is javari located in
<dbpedia:Judit_Polgár>,Judit Polgár,"Judit Polgár (born 23 July 1976) is a Hungarian chess grandmaster. She is generally considered the strongest female chess player in history. In 1991, Polgár achieved the title of Grandmaster at the age of 15 years and 4 months, at the time the youngest to have done so, breaking the record previously held by former World Champion Bobby Fischer. She is the youngest ever player, to date, to break into the FIDE Top 100 players rating list, being ranked No.",youngest female chess player
<dbpedia:Jupiter_Ace>,Jupiter Ace,"The Jupiter Ace was a British home computer of the early 1980s, produced by a company, set up for the purpose, named Jupiter Cantab. The Ace differed from other microcomputers of the time in that it used Forth instead of the more common BASIC.",who makes jupiter computer
<dbpedia:Jewish_holidays>,Jewish holidays,"Jewish holidays, also known as Jewish festivals or Yamim Tovim (ימים טובים, ""Good Days"", or singular יום טוב Yom Tov, in transliterated Hebrew [English /ˈjɔːm ˈtɔːv, joʊm ˈtoʊv/]), are holidays observed by Jews throughout the Jewish year. They are derived from three sources: Biblical mitzvot (""commandments""); rabbinic mandates; and the modern history of Israel.",what are jewish holidays?
<dbpedia:John_Peel>,John Peel,"John Robert Parker Ravenscroft, OBE (30 August 1939 – 25 October 2004), known professionally as John Peel, was an English disc jockey, radio presenter, record producer and journalist. He was the longest serving of the original BBC Radio 1 DJs, broadcasting regularly from 1967 until his death in 2004.",what was john peel
<dbpedia:Joseph_Haydn>,Joseph Haydn,"(Franz) Joseph Haydn (/ˈdʒoʊzəf ˈhaɪdən/; German: [ˈjoːzɛf ˈhaɪdən]; 31 March 1732 – 31 May 1809) was a prominent and prolific Austrian composer of the Classical period. He was instrumental in the development of chamber music such as the piano trio and his contributions to musical form have earned him the epithets ""Father of the Symphony"" and ""Father of the String Quartet"".Haydn spent much of his career as a court musician for the wealthy Esterházy family at their remote estate.",who was joseph haydn
<dbpedia:Jock_Taylor>,Jock Taylor,"Jock Taylor (March 9, 1954 – August 15, 1982) was a Scottish World Champion motorcycle sidecar racer.John Robert (Jock) Taylor was born in Pencaitland, East Lothian, and entered his first sidecar race at the age of 19, as the passenger to Kenny Andrews (1974). The following year he took part in his first race as a driver. Taylor died in Finland as a consequence of a racing incident in 1982.",who is jock taylor
<dbpedia:July_21>,July 21,July 21 is the 202nd day of the year (203rd in leap years) in the Gregorian calendar. There are 163 days remaining until the end of the year.,what day is the end of july
<dbpedia:John_von_Neumann>,John von Neumann,"John von Neumann (Hungarian: Neumann János, /vɒn ˈnɔɪmən/; December 28, 1903 – February 8, 1957) was a Hungarian-American pure and applied mathematician, physicist, inventor, polymath, and polyglot.",when was john neumann born
<dbpedia:J._R._R._Tolkien>,J. R. R. Tolkien,"John Ronald Reuel Tolkien CBE FRSL (/ˈtɒlkiːn/; 3 January 1892 – 2 September 1973) was an English writer, poet, philologist, and university professor who is best known as the author of the classic high-fantasy works The Hobbit, The Lord of the Rings, and The Silmarillion.He served as the Rawlinson and Bosworth Professor of Anglo-Saxon and Fellow of Pembroke College, Oxford, from 1925 to 1945 and Merton Professor of English Language and Literature and Fellow of Merton College, Oxford from 1945 to 1959.",what books did tolkien write
<dbpedia:July_23>,July 23,July 23 is the 204th day of the year (205th in leap years) in the Gregorian calendar. There are 161 days remaining until the end of the year.,how many days until the end of the year are there
<dbpedia:John_Calvin>,John Calvin,"John Calvin (/ˈkælvɪn/; French: Jean Calvin, pronounced: [ʒɑ̃ kalvɛ̃]; born Jehan Cauvin: 10 July 1509 – 27 May 1564) was an influential French theologian and pastor during the Protestant Reformation. He was a principal figure in the development of the system of Christian theology later called Calvinism, aspects of which include the doctrine of predestination and the absolute sovereignty of God in salvation of the human soul from death and eternal damnation.",who is john calvin?
<dbpedia:John_Irving>,John Irving,"John Winslow Irving (born John Wallace Blunt, Jr. on March 2, 1942), is an American novelist and Academy Award-winning screenwriter.Irving achieved critical and popular acclaim after the international success of The World According to Garp in 1978. Some of Irving's novels, such as The Cider House Rules (1985), A Prayer for Owen Meany (1989), and A Widow for One Year (1998), have been bestsellers. Five of his novels have been adapted to film.",john irving what years was he born
<dbpedia:Justus_von_Liebig>,Justus von Liebig,"Justus Freiherr von Liebig (12 May 1803 – 18 April 1873) was a German chemist who made major contributions to agricultural and biological chemistry, and was considered the founder of organic chemistry. As a professor at the University of Giessen, he devised the modern laboratory-oriented teaching method, and for such innovations, he is regarded one of the greatest chemistry teachers of all time.",who invented the modern laboratory method
<dbpedia:John_Stuart_Mill>,John Stuart Mill,"John Stuart Mill (20 May 1806 – 8 May 1873) was a British philosopher, political economist and civil servant. He was an influential contributor to social theory, political theory and political economy. He has been called ""the most influential English-speaking philosopher of the nineteenth century"".",who is john stuart mill?
<dbpedia:Johann_Bayer>,Johann Bayer,"Johann Bayer (1572 – 7 March 1625) was a German lawyer and uranographer (celestial cartographer). He was born in Rain, Lower Bavaria, in 1572. At twenty, in 1592 he began his study of philosophy and law at the University of Ingolstadt, after which he moved to Augsburg to begin work as a lawyer, becoming legal adviser to the city council in 1612.Bayer had several interests outside his work, including archaeology and mathematics.",where did johann bayer come from
<dbpedia:January_14>,January 14,"January 14 is the 14th day of the year in the Gregorian calendar. There are 351 days remaining until the end of the year (352 in leap years).In the 20th and 21st centuries the Julian calendar is 13 days behind the Gregorian calendar, thus January 14 is sometimes celebrated as New Year's Day (Old New Year) by religious groups who use the Julian calendar.",what days does january 14
<dbpedia:January_13>,January 13,January 13 is the 13th day of the year in the Gregorian calendar. There are 352 days remaining until the end of the year (353 in leap years).It is sometimes celebrated as New Year's Eve (at least in the 20th & 21st centuries) by ethnic groups and religious orders still using the thirteen-days-adrift Julian calendar (Old New Year).,how many days until the end of the year
<dbpedia:Johann_Tobias_Krebs>,Johann Tobias Krebs,Johann Tobias Krebs (7 July 1690 – 11 February 1762) was a German organist and composer.Krebs was born in Heichelheim and died in Buttstädt. He is known as a student of Johann Gottfried Walther and Johann Sebastian Bach.He is believed to be the composer of the Eight Short Preludes and Fugues previously attributed to J.S. Bach.,who is tobias krebs
<dbpedia:Jane_Shore>,Jane Shore,"Elizabeth ""Jane"" Shore (nee Lambert) (c.1445 – c.1527) was one of the many mistresses of King Edward IV of England, one of three whom he described as ""the merriest, the wiliest, and the holiest harlots"" in his realm. She also became a concubine to other noblemen, including Edward's stepson, Thomas Grey, 1st Marquess of Dorset, and William Hastings, 1st Baron Hastings, his close friend and adviser.",what was jane shore's name
<dbpedia:Josephus_on_Jesus>,Josephus on Jesus,The extant manuscripts of the writings of the 1st-century Romano-Jewish historian Flavius Josephus include references to Jesus and the origins of Christianity.,who wrote about jesus
<dbpedia:John_Lennon>,John Lennon,"John Winston Ono Lennon MBE (born John Winston Lennon; 9 October 1940 – 8 December 1980) was an English singer and songwriter who rose to worldwide fame as a co-founder  of the band the Beatles, the most commercially successful band in the history of popular music.",who was the founder of beatles
<dbpedia:January_18>,January 18,January 18 is the 18th day of the year in the Gregorian calendar. There are 347 days remaining until the end of the year (348 in leap years).,what is the 18th day in january?
<dbpedia:James_Thurber>,James Thurber,"James Grover Thurber (December 8, 1894 – November 2, 1961) was an American cartoonist, author, journalist, playwright, and celebrated wit. Thurber was best known for his cartoons and short stories, published mainly in The New Yorker magazine and collected in his numerous books. One of the most popular humorists of his time, Thurber celebrated the comic frustrations and eccentricities of ordinary people.",who was the most popular american writer
<dbpedia:Jutes>,Jutes,"The Jutes, Iuti, or Iutæ (/dʒuːts/) were a Germanic people. According to Bede, the Jutes were one of the three most powerful Germanic peoples of their time, the other two being the Saxons and the Angles.The Jutes are believed to have originated from the Jutland Peninsula (called Iutum in Latin) and part of the North Frisian coast. In present times the Jutlandic Peninsula consists of the mainland of Denmark and Southern Schleswig in Germany.",what are jutes
<dbpedia:Jean-Jacques_Rousseau>,Jean-Jacques Rousseau,"Jean-Jacques Rousseau (/ruːˈsoʊ/; French: [ʒɑ̃ʒak ʁuso]; 28 June 1712 – 2 July 1778) was a philosopher, writer, and composer of the 18th century. His political philosophy influenced the Enlightenment in France and across Europe, as well as aspects of the French Revolution and the overall development of modern political and educational thought.Rousseau's novel Emile, or On Education is a treatise on the education of the whole person for citizenship.",what was jean-jacques rousseau major achievements
<dbpedia:John_Martyn>,John Martyn,"John Martyn, OBE (11 September 1948 – 29 January 2009), born as  Iain David McGeachy, was a British singer-songwriter and guitarist. Over a 40-year career, he released 21 studio albums, working with artists such as Eric Clapton, David Gilmour and Phil Collins. He was described by The Times as ""an electrifying guitarist and singer whose music blurred the boundaries between folk, jazz, rock and blues"".",who is john martyn?
<dbpedia:Joseph_Stalin>,Joseph Stalin,"Joseph Stalin (birth surname: Jughashvili; 18 December 1878 – 5 March 1953) was the leader of the Soviet Union from the mid-1920s until his death in 1953. Holding the post of the General secretary of the Central Committee of the Communist Party of the Soviet Union, he was effectively the dictator of the state.Stalin was one of the seven members of the first Politburo, founded in 1917 in order to manage the Bolshevik Revolution, alongside Lenin, Zinoviev, Kamenev, Trotsky, Sokolnikov and Bubnov.",where did stalin start from
<dbpedia:Joe_Pass>,Joe Pass,"Joe Pass (born Joseph Anthony Jacobi Passalacqua, January 13, 1929 – May 23, 1994) was an American virtuoso jazz guitarist of Sicilian descent. He is generally considered to be one of the greatest jazz guitarists of the 20th century.",who is joe pass
<dbpedia:Jumping_the_broom>,Jumping the broom,Jumping the broom is a phrase and custom relating to a wedding ceremony where the couple jumps over a broom.,what is the saying for jumping the broom
<dbpedia:John_Hagelin>,John Hagelin,"John Samuel Hagelin (born June 9, 1954) is an American particle physicist, three-time candidate of the Natural Law Party for President of the United States (1992, 1996, and 2000), and director of the Transcendental Meditation movement for the United States.As a researcher at the European Organization for Nuclear Research (CERN) (1981–1982) and the Stanford Linear Accelerator Center (SLAC) (1982–1983), Hagelin made contributions to the development of unified field theory.",what does john hagelin have a good name for
<dbpedia:Jacobin_(politics)>,Jacobin (politics),"During the French Revolution (1789 to 1799), a Jacobin (French pronunciation: ​[ʒakɔbɛ̃]) was a member of the Jacobin Club, a revolutionary political movement that had been the most famous political club of the French Revolution. The club was so called from the Dominican convent where they originally met, in the Rue Saint-Jacques (Latin: Jacobus) in Paris.Today, Jacobin  and Jacobinism are used in a variety of senses.",what was jacob
<dbpedia:JPEG_Network_Graphics>,JPEG Network Graphics,"JPEG Network Graphics (JNG, /ˈdʒɪŋ/) is a JPEG-based graphics file format which is closely related to PNG: it uses the PNG file structure (with a different signature) as a container format to wrap JPEG-encoded image data.JNG was created as an adjunct to the MNG animation format, but may be used as a stand-alone format.",what is jpg
<dbpedia:James_Whale>,James Whale,"James Whale (22 July 1889 – 29 May 1957)  was an English film director, theatre director and actor. He is best remembered for his four classic horror films: Frankenstein (1931), The Old Dark House (1932), The Invisible Man (1933) and Bride of Frankenstein (1935). Whale also directed films in other genres, including what is considered the definitive film version of the musical Show Boat (1936).",who directed the movies frankenstein
<dbpedia:John_Lynch_(New_Hampshire)>,John Lynch (New Hampshire),"John H. Lynch (born November 25, 1952) is an American businessman and politician who served as the 80th Governor of the U.S. State of New Hampshire. Lynch was first elected Governor in 2004, defeating first-term incumbent Governor Craig Benson - the first time an incumbent Governor was denied a second term in 78 years. Lynch won re-election in landslide victories in 2006 and 2008, and comfortably won a historic fourth term in 2010.",who is governor lynch
<dbpedia:James_Madison_University>,James Madison University,"James Madison University (also known as JMU, Madison, or James Madison) is a public coeducational research university located in Harrisonburg, Virginia, United States. Founded in 1908 as the State Normal and Industrial School for Women at Harrisonburg, the institution was renamed Madison College in 1938, in honor of President James Madison, and named James Madison University in 1977.",where is james madison university located
<dbpedia:John_Danforth>,John Danforth,"John Claggett Danforth (born September 5, 1936) is a former United States Permanent Representative to the United Nations. Before becoming the UN Ambassador he was the Attorney General of Missouri and United States Senator from Missouri. He is also an ordained Episcopal priest.",who is john dandford
<dbpedia:Joshua>,Joshua,"Joshua (/ˈdʒɒʃuːə/) or Jehoshua (Hebrew: יְהוֹשֻׁעַ Yĕhôshúa or Hebrew: יֵשׁוּעַ Yĕshúa; Aramaic: ܝܫܘܥ‎ Isho; Greek: Ἰησοῦς, Arabic: يوشع بن نون‎, Latin: Iosue, Yūshaʿ ibn Nūn, Turkish: Yuşa), is a figure in the Torah, being one of the spies for Israel (Num 13–14) and identified in several passages as Moses' assistant. He is the central character in the Hebrew Bible's Book of Joshua.",who is yoshua in aramaic
<dbpedia:Jerome_Kern>,Jerome Kern,"Jerome David Kern (January 27, 1885 – November 11, 1945) was an American composer of musical theatre and popular music.  One of the most important American theatre composers of the early 20th century, he wrote more than 700 songs, used in over 100 stage works, including such classics as ""Ol' Man River"", ""Can't Help Lovin' Dat Man"", ""A Fine Romance"", ""Smoke Gets in Your Eyes"", ""All the Things You Are"", ""The Way You Look Tonight"", ""Long Ago (and Far Away)"" and ""Who?"".",who is jerome kern
<dbpedia:James_Spader>,James Spader,"James Todd Spader (born February 7, 1960) is an American actor. He is best known for portraying eccentric characters in such films as the action science fiction film Stargate (1994), the controversial psychological thriller Crash (1996), and the erotic romance Secretary (2002).His most well-known television roles are those of attorney Alan Shore in The Practice and its spin-off Boston Legal (for which he won three Emmy Awards), and Robert California in the comedy-mockumentary The Office.",who is james spader
<dbpedia:Jim_Bakker>,Jim Bakker,"James Orsen ""Jim"" Bakker (pronounced ""Baker""; born January 2, 1940) is an American televangelist, a former Assemblies of God minister and a former host (with his then-wife Tammy Faye Bakker) of The PTL Club, a popular evangelical Christian television program.A sex scandal led to his resignation from the ministry. Subsequent revelations of accounting fraud brought about his imprisonment and divorce. He later remarried and returned to televangelism.",who is james bakker
<dbpedia:Jehoshaphat>,Jehoshaphat,"Jehoshaphat (/dʒəˈhɒʃəfæt/; alternatively spelled Jehosaphat, Josaphat, or Yehoshafat; Hebrew: יְהוֹשָׁפָט, Modern Yehoshafat, Tiberian Yəhôšāp̄āṭ ; ""Jehovah has judged""; Greek: Ἰωσαφάτ; Latin: Josaphat) was the fourth king of the Kingdom of Judah, and successor of his father Asa. His children included Jehoram, who succeeded him as king. His mother was Azubah.",what did jehoshaphat edouard say
<dbpedia:Jackal>,Jackal,"The jackal is a small omnivorous mammal of the genus Canis, which also includes the wolf and dog.",what is jackal
<dbpedia:John_Diefenbaker>,John Diefenbaker,"John George Diefenbaker PC CH QC (/ˈdiːfənˌbeɪkər/; September 18, 1895 – August 16, 1979) was the 13th Prime Minister of Canada, serving from June 21, 1957, to April 22, 1963. He was the only Progressive Conservative (PC or Tory) party leader between 1930 and 1979 to lead the party to an election victory, doing so three times, although only once with a majority of seats in the Canadian House of Commons.Diefenbaker was born in southwestern Ontario in 1895.",who was john diefenbaker
<dbpedia:Jacob>,Jacob,"Jacob (later given the name Israel) is considered a patriarch of the Israelites. According to the Book of Genesis, Jacob (/ˈdʒeɪkəb/; Hebrew: יַעֲקֹב Standard Yaʿakov) was the third Hebrew progenitor with whom God made a covenant. He is the son of Isaac and Rebecca, the grandson of Abraham, Sarah and of Bethuel, and the younger twin brother of Esau.",who is jacob in israel
<dbpedia:J._K._Rowling>,J. K. Rowling,"Joanne  ""Jo"" Rowling, OBE FRSL (/ˈroʊlɪŋ/; born 31 July 1965), pen names J. K. Rowling and Robert Galbraith, is a British novelist best known as the author of the Harry Potter fantasy series. The books have gained worldwide attention, won multiple awards, and sold more than 400 million copies. They have become the best-selling book series in history and been the basis for a series of films which is the second highest-grossing film series in history.",who wrote the harry potter series
<dbpedia:Joystick>,Joystick,"A joystick is an input device consisting of a stick that pivots on a base and reports its angle or direction to the device it is controlling. A joystick, also known as the control column, is the principal control device in the cockpit of many civilian and military aircraft, either as a center stick or side-stick.",what is a joystick
<dbpedia:John_the_Baptist>,John the Baptist,"John the Baptist (Ancient Greek: Ἰωάννης ὁ βαπτιστής Ioannēs ho baptistēs or Ἰωάννης ὁ βαπτίζων Ioannēs ho baptizōn  was an itinerant preacher and a major religious figure in Christianity, Islam, the Bahá'í Faith, and Mandaeism.John is described as having the unique practice of baptism for the forgiveness of sins. Most scholars agree that John baptized Jesus.",what was john the baptist believed to have done
<dbpedia:Jimi_Hendrix>,Jimi Hendrix,"James Marshall ""Jimi"" Hendrix (born Johnny Allen Hendrix; November 27, 1942 – September 18, 1970) was an American rock guitarist, singer, and songwriter. Although his mainstream career spanned only four years, he is widely regarded as one of the most influential electric guitarists in the history of popular music, and one of the most celebrated musicians of the 20th century.",what was jimi hendrix born
<dbpedia:Society_of_Jesus>,Society of Jesus,"The Society of Jesus (Latin: Societas Iesu, S.J., SJ or SI) is a male religious congregation of the Catholic Church. The members are called Jesuits. The society is engaged in evangelization and apostolic ministry in 112 nations on six continents. Jesuits work in education (founding schools, colleges, universities and seminaries), intellectual research, and cultural pursuits.",how many jesuits are in the sj
<dbpedia:John_William_Polidori>,John William Polidori,"John William Polidori (7 September 1795 – 24 August 1821) was an English writer and physician. He is known for his associations with the Romantic movement and credited by some as the creator of the vampire genre of fantasy fiction. His most successful work was the short story, ""The Vampyre"" (1819), the first published modern vampire story. Although originally and erroneously accredited to Lord Byron, both Byron and Polidori affirmed that the story is Polidori's.",what is polidori best known for
<dbpedia:Jan_Hus>,Jan Hus,"Jan Hus (/hʊs/; Czech: [ˈjan ˈɦus]; c. 1369 – 6 July 1415), often referred to in English as John Hus or John Huss, was a Czech priest, philosopher, early Christian reformer and Master at Charles University in Prague.",what is jnhus
<dbpedia:Homosexuality_and_Judaism>,Homosexuality and Judaism,The subject of homosexual behavior and Judaism dates back to the Torah.,is judaism about homosexuality
<dbpedia:Joint_Political_Military_Group>,Joint Political Military Group,"On November 29, 1983 a memorandum of agreement was set up between Israel and the United States regarding political, military and economic cooperation. Part of the agreement was for a Joint Political Military Group (JPMG) as a high-level planning forum to discuss and implement combined planning, joint exercises, and logistics. The JPMG is co-chaired by the director general of the Israeli Ministry of Defense and the U.S. Assistant Secretary of State for Political-Military Affairs.",what was jpmg
<dbpedia:James_Cagney>,James Cagney,"James Francis Cagney, Jr. (July 17, 1899 – March 30, 1986) was an American actor and dancer, both on stage and in film, though he had his greatest impact in film. Known for his consistently energetic performances, distinctive vocal style, and deadpan comic timing, he won acclaim and major awards for a wide variety of performances.",who is james magnany
<dbpedia:Jacquard_loom>,Jacquard loom,"The Jacquard loom is a mechanical loom, invented by Joseph Marie Jacquard, first demonstrated in 1801, that simplifies the process of manufacturing textiles with such complex patterns as brocade, damask and matelasse. The loom was controlled by a ""chain of cards"", a number of punched cards, laced together into a continuous sequence. Multiple rows of holes were punched on each card, with one complete card corresponding to one row of the design.",what year was the jacquard loom invented
<dbpedia:James_Watt>,James Watt,"James Watt, FRS, FRSE (30 January 1736 (19 January 1736 OS) – 25 August 1819) was a Scottish inventor and mechanical engineer whose Watt steam engine, an improvement of the Newcomen steam engine, was fundamental to the changes brought by the Industrial Revolution in both his native Great Britain and the rest of the world.While working as an instrument maker at the University of Glasgow, Watt became interested in the technology of steam engines.",what was james watt inventor
<dbpedia:James_Clavell>,James Clavell,"James Clavell (10 October 1921 – 6 September 1994), born Charles Edmund Dumaresq Clavell, was an Australian-born British (later naturalized American) novelist, screenwriter, director, and World War II veteran and prisoner of war. Clavell is best known for his epic Asian Saga series of novels and their televised adaptations, along with such films as The Great Escape (1963) and To Sir, with Love (1967).",who is james clavell
